{
  "$schema": "https://schemas.alos.dev/v1/agent/agent-run-result.schema.json",
  "run_id": "run_mvp1_document_review_001",
  "root_run_id": "run_mvp1_document_review_001",
  "correlation_id": "corr_mvp1_contract_001",
  "agent_id": "agent_mvp1_document_reviewer",
  "agent_version": "1.0.0",
  "capability_id": "capability_mvp1_document_review",
  "status": "COMPLETED",
  "output_state": "NEEDS_REVIEW",
  "output": {
    "summary": "Review completed and requires authoritative human review."
  },
  "usage": {
    "provider": "fixture",
    "model": "deterministic-test-model",
    "input_tokens": 120,
    "output_tokens": 48,
    "latency_milliseconds": 25,
    "estimated_cost": 0
  },
  "evidence_refs": [],
  "started_at": "2026-09-16T02:00:00Z",
  "completed_at": "2026-09-16T02:00:01Z"
}
